{
  "kind": "secretObjective",
  "id": "obj.secret.loner",
  "name": "Loner",
  "type": "secret",
  "requiresMain": true,
  "complete": {
    "all": [
      {
        "test": "survivorsAtLeast",
        "subject": "holder",
        "value": 1
      },
      {
        "test": "survivorsAtMost",
        "subject": "holder",
        "value": 1
      }
    ]
  },
  "text": {
    "goal": "The colony pulls through and you control exactly one survivor."
  },
  "sources": {
    "complete": "PHOTO es-secret-objectives; BGG etwest-names",
    "requiresMain": "R p3"
  },
  "status": "draft",
  "notes": "src: objectives-sources.md B row 16"
}
