{
  "kind": "secretObjective",
  "id": "obj.secret.hunger",
  "name": "Hunger",
  "type": "secret",
  "requiresMain": true,
  "complete": {
    "test": "handHasSymbol",
    "subject": "holder",
    "symbol": "food",
    "value": 3
  },
  "text": {
    "goal": "The colony pulls through and you hold at least three food-symbol cards."
  },
  "sources": {
    "complete": "PHOTO hunger; BGG etwest-names",
    "requiresMain": "R p3"
  },
  "status": "draft",
  "notes": "src: objectives-sources.md B row 11"
}
