{
  "kind": "secretObjective",
  "id": "obj.secret.burn-it-all-down",
  "name": "Burn it all down",
  "type": "secret",
  "requiresMain": true,
  "complete": {
    "all": [
      {
        "test": "barricadesAtLeast",
        "subject": "colony",
        "location": "colony",
        "value": 4
      },
      {
        "test": "handHasSymbol",
        "subject": "holder",
        "symbol": "fuel",
        "value": 1
      }
    ]
  },
  "text": {
    "goal": "The colony pulls through, the colony entrances carry at least four barricades, and you hold a fuel card."
  },
  "sources": {
    "complete": "PHOTO es-secret-objectives; BGG etwest-names",
    "requiresMain": "R p3"
  },
  "status": "draft",
  "notes": "src: objectives-sources.md B row 3"
}
