{
  "kind": "secretObjective",
  "id": "obj.secret.the-way-back-home",
  "name": "The way back home",
  "type": "secret",
  "requiresMain": true,
  "complete": {
    "all": [
      {
        "test": "handHasSymbol",
        "subject": "holder",
        "symbol": "fuel",
        "value": 2
      },
      {
        "test": "handHasSymbol",
        "subject": "holder",
        "symbol": "food",
        "value": 1
      },
      {
        "test": "handHasSymbol",
        "subject": "holder",
        "symbol": "weapon",
        "value": 1
      }
    ]
  },
  "text": {
    "goal": "The colony pulls through and you hold two fuel cards, a food card and a weapon card."
  },
  "sources": {
    "complete": "PHOTO es-secret-objectives; BGG etwest-names",
    "requiresMain": "R p3"
  },
  "status": "draft",
  "notes": "src: objectives-sources.md B row 23"
}
