{
  "kind": "secretObjective",
  "id": "obj.secret.desire-to-live",
  "name": "Desire to live",
  "type": "secret",
  "requiresMain": true,
  "complete": {
    "all": [
      {
        "test": "handHasSymbol",
        "subject": "holder",
        "symbol": "weapon",
        "value": 1
      },
      {
        "test": "handHasSymbol",
        "subject": "holder",
        "symbol": "food",
        "value": 1
      },
      {
        "test": "handHasSymbol",
        "subject": "holder",
        "symbol": "fuel",
        "value": 1
      },
      {
        "test": "handHasSymbol",
        "subject": "holder",
        "symbol": "medicine",
        "value": 1
      }
    ]
  },
  "text": {
    "goal": "The colony pulls through and you hold at least one weapon, one food, one fuel and one medicine card."
  },
  "sources": {
    "complete": "PHOTO es-secret-objectives; BGG etwest-names",
    "requiresMain": "R p3"
  },
  "status": "draft",
  "notes": "src: objectives-sources.md B row 5"
}
