{
  "kind": "secretObjective",
  "id": "obj.exiled.resourceful",
  "name": "Resourceful",
  "type": "exiled",
  "requiresMain": true,
  "complete": {
    "test": "handHasSymbol",
    "subject": "holder",
    "symbol": "tool",
    "value": 4
  },
  "betrayer": {
    "firstCondition": {
      "test": "handHasSymbol",
      "subject": "holder",
      "symbol": "tool",
      "value": 3
    }
  },
  "text": {
    "goal": "The colony pulls through and you hold at least four tool cards.",
    "betrayer": "Your first demand becomes at least three tool cards in your hand."
  },
  "sources": {
    "complete": "PHOTO es-habil; BGG ludopedia-51112",
    "requiresMain": "PHOTO es-habil; BGG ludopedia-51112",
    "betrayer.firstCondition": "PHOTO es-habil; BGG ludopedia-51112"
  },
  "status": "draft",
  "notes": "src: objectives-sources.md D row 10 (D3)"
}
