{
  "kind": "secretObjective",
  "id": "obj.exiled.new-friends",
  "name": "New Friends",
  "type": "exiled",
  "requiresMain": true,
  "complete": {
    "code": "rule.group-size.mostSurvivors",
    "params": {
      "margin": 1
    }
  },
  "betrayer": {
    "firstCondition": {
      "code": "rule.location-deck.emptyAtLeast",
      "params": {
        "n": 1
      }
    }
  },
  "text": {
    "goal": "The colony pulls through and your group has more survivors than any other player's.",
    "betrayer": "Your first demand becomes at least one location with an emptied item deck."
  },
  "sources": {
    "complete": "PHOTO es-nuevos-amigos; BGG ludopedia-51112",
    "requiresMain": "PHOTO es-nuevos-amigos; BGG ludopedia-51112",
    "betrayer.firstCondition": "PHOTO es-nuevos-amigos; BGG ludopedia-51112"
  },
  "status": "draft",
  "notes": "src: objectives-sources.md D row 3 (D1)"
}
