{
  "kind": "secretObjective",
  "id": "obj.secret.zombie-killing-robot",
  "name": "Zombie killing robot!",
  "type": "secret",
  "requiresMain": true,
  "complete": {
    "all": [
      {
        "test": "handHasSymbol",
        "subject": "holder",
        "symbol": "weapon",
        "value": 1
      },
      {
        "test": "handHasSymbol",
        "subject": "holder",
        "symbol": "tool",
        "value": 2
      }
    ]
  },
  "text": {
    "goal": "The colony pulls through and you hold a weapon card and two tool cards."
  },
  "sources": {
    "complete": "PHOTO es-secret-objectives; BGG etwest-names",
    "requiresMain": "R p3"
  },
  "status": "draft",
  "notes": "src: objectives-sources.md B row 24"
}
