{
  "kind": "secretObjective",
  "id": "obj.exiled.the-chosen",
  "name": "The Chosen",
  "type": "exiled",
  "requiresMain": false,
  "complete": {
    "all": [
      {
        "test": "survivorsAtLeast",
        "subject": "holder",
        "value": 3
      },
      {
        "code": "rule.seat-survivors.allWoundless"
      }
    ]
  },
  "betrayer": {
    "firstCondition": {
      "all": [
        {
          "code": "rule.seat-survivors.allWoundless"
        },
        {
          "code": "rule.barricades.totalAtLeast",
          "params": {
            "n": 5
          }
        }
      ]
    }
  },
  "text": {
    "goal": "You control at least three survivors and none of them carries a wound.",
    "betrayer": "Your first demand becomes: none of your survivors wounded and at least five barricades on the board."
  },
  "sources": {
    "complete": "BGG ludopedia-51112",
    "requiresMain": "BGG ludopedia-51112",
    "betrayer.firstCondition": "BGG ludopedia-51112"
  },
  "status": "draft",
  "notes": "src: objectives-sources.md D row 6"
}
