{
  "kind": "secretObjective",
  "id": "obj.exiled.shelter",
  "name": "Shelter",
  "type": "exiled",
  "requiresMain": false,
  "complete": {
    "code": "rule.locations.barricadedAtLeast",
    "params": {
      "locations": 3,
      "barricades": 2
    }
  },
  "betrayer": {
    "firstCondition": {
      "code": "rule.seat.mostEquippedWeapons"
    }
  },
  "text": {
    "goal": "At least three locations each carry two or more barricades.",
    "betrayer": "Your first demand becomes carrying more equipped weapons than any other player."
  },
  "sources": {
    "complete": "BGG ludopedia-51112",
    "requiresMain": "BGG ludopedia-51112",
    "betrayer.firstCondition": "BGG ludopedia-51112"
  },
  "status": "draft",
  "notes": "src: objectives-sources.md D row 4"
}
