{
  "kind": "secretObjective",
  "id": "obj.secret.leader",
  "name": "Leader",
  "type": "secret",
  "requiresMain": true,
  "complete": {
    "code": "rule.group-size.mostSurvivors",
    "params": {
      "margin": 1
    }
  },
  "text": {
    "goal": "The colony pulls through and your group has more survivors than any other player's."
  },
  "sources": {
    "complete": "PHOTO es-secret-objectives; BGG etwest-names",
    "requiresMain": "R p3"
  },
  "status": "draft",
  "notes": "src: objectives-sources.md B row 15"
}
