{
  "kind": "secretObjective",
  "id": "obj.secret.collector",
  "name": "Collector",
  "type": "secret",
  "requiresMain": true,
  "complete": {
    "test": "handAtLeast",
    "subject": "holder",
    "value": 4
  },
  "text": {
    "goal": "The colony pulls through and your hand holds at least four item cards of any kind."
  },
  "sources": {
    "complete": "PHOTO es-secret-objectives; BGG etwest-names; BGG unboxing",
    "requiresMain": "R p3"
  },
  "status": "draft",
  "notes": "src: objectives-sources.md B row 4"
}
