{
  "kind": "secretObjective",
  "id": "obj.secret.germ-a-phobe",
  "name": "Germ-a-phobe",
  "type": "secret",
  "requiresMain": true,
  "complete": {
    "code": "rule.seat-survivors.allWoundless"
  },
  "text": {
    "goal": "The colony pulls through and none of your survivors carries a wound of any kind."
  },
  "sources": {
    "complete": "PHOTO es-secret-objectives; BGG etwest-names",
    "requiresMain": "R p3"
  },
  "status": "draft",
  "notes": "src: objectives-sources.md B row 7"
}
