{
  "kind": "secretObjective",
  "id": "obj.exiled.forgiveness",
  "name": "Forgiveness",
  "type": "exiled",
  "requiresMain": true,
  "complete": {
    "test": "handHasSymbol",
    "subject": "holder",
    "symbol": "food",
    "value": 5
  },
  "betrayer": {
    "firstCondition": {
      "code": "rule.objective.mainComplete"
    }
  },
  "text": {
    "goal": "The colony pulls through and you are carrying five cans of food when it does.",
    "betrayer": "Your first demand becomes simply that the colony pulls through."
  },
  "sources": {
    "complete": "PHOTO es-perdon; BGG ludopedia-51112",
    "requiresMain": "PHOTO es-perdon; BGG ludopedia-51112",
    "betrayer.firstCondition": "PHOTO es-perdon; BGG ludopedia-51112"
  },
  "status": "draft",
  "notes": "src: objectives-sources.md D row 8"
}
