{
  "kind": "secretObjective",
  "id": "obj.exiled.remorse",
  "name": "Remorse",
  "type": "exiled",
  "requiresMain": true,
  "complete": {
    "test": "handHasSymbol",
    "subject": "holder",
    "symbol": "medicine",
    "value": 4
  },
  "betrayer": {
    "firstCondition": {
      "test": "handAtLeast",
      "subject": "holder",
      "value": 10
    }
  },
  "text": {
    "goal": "The colony pulls through and you hold at least four medicine cards.",
    "betrayer": "Your first demand becomes a hand of at least ten cards."
  },
  "sources": {
    "complete": "BGG ludopedia-51112",
    "requiresMain": "BGG ludopedia-51112",
    "betrayer.firstCondition": "BGG ludopedia-51112"
  },
  "status": "draft",
  "notes": "src: objectives-sources.md D row 1"
}
