{
  "kind": "secretObjective",
  "id": "obj.secret.a-new-destination",
  "name": "A new destination",
  "type": "secret",
  "requiresMain": true,
  "complete": {
    "test": "handHasSymbol",
    "subject": "holder",
    "symbol": "fuel",
    "value": 3
  },
  "text": {
    "goal": "The colony pulls through and you are holding at least three fuel cards."
  },
  "sources": {
    "complete": "PHOTO es-secret-objectives; BGG etwest-names",
    "requiresMain": "R p3"
  },
  "status": "draft",
  "notes": "src: objectives-sources.md B row 1"
}
